{
  "$schema": "http://json-schema.org/draft-07/schema#",
  "title": "horoscope_interpretation_request_v1",
  "type": "object",
  "required": [
    "contract_version",
    "service_code",
    "period",
    "target_language",
    "day_overview",
    "slots",
    "main_signals",
    "dominant_themes",
    "evidence"
  ],
  "additionalProperties": false,
  "allOf": [
    {
      "if": {
        "properties": {
          "service_code": { "const": "horoscope_basic_daily_natal_3_slots" }
        },
        "required": ["service_code"]
      },
      "then": {
        "properties": {
          "slots": { "minItems": 3, "maxItems": 3 }
        }
      }
    },
    {
      "if": {
        "properties": {
          "service_code": { "const": "horoscope_free_daily" }
        },
        "required": ["service_code"]
      },
      "then": {
        "properties": {
          "slots": { "minItems": 1, "maxItems": 1 }
        }
      }
    },
    {
      "if": {
        "properties": {
          "service_code": { "const": "horoscope_premium_daily_local_2h_slots" }
        },
        "required": ["service_code"]
      },
      "then": {
        "required": ["best_slots", "watch_slots", "domain_sections"],
        "properties": {
          "slots": { "minItems": 12, "maxItems": 12 },
          "main_signals": { "maxItems": 24 },
          "evidence": { "maxItems": 60 }
        }
      }
    }
  ],
  "properties": {
    "contract_version": { "const": "horoscope_interpretation_request_v1" },
    "service_code": {
      "enum": [
        "horoscope_basic_daily_natal_3_slots",
        "horoscope_free_daily",
        "horoscope_premium_daily_local_2h_slots"
      ]
    },
    "period": {
      "type": "object",
      "required": ["date", "timezone"],
      "properties": {
        "date": { "type": "string" },
        "timezone": { "type": "string" }
      }
    },
    "target_language": { "type": "string" },
    "day_overview": {
      "type": "object",
      "required": ["dominant_theme", "tone", "intensity", "summary_hint", "evidence_keys"],
      "additionalProperties": false,
      "properties": {
        "dominant_theme": { "type": "string" },
        "tone": { "type": "string" },
        "intensity": { "type": "string" },
        "summary_hint": { "type": "string" },
        "evidence_keys": {
          "type": "array",
          "maxItems": 3,
          "items": { "type": "string" }
        }
      }
    },
    "slots": {
      "type": "array",
      "minItems": 1,
      "maxItems": 12,
      "items": {
        "type": "object",
        "required": [
          "slot_code",
          "slot_label",
          "specificity",
          "theme_code",
          "tone",
          "intensity",
          "main_signal_keys",
          "required_evidence_keys",
          "advice_axis",
          "avoid_axis",
          "watch_point",
          "best_for",
          "fallback_reason"
        ],
        "additionalProperties": false,
        "properties": {
          "slot_code": { "type": "string" },
          "slot_label": { "type": "string" },
          "specificity": { "enum": ["specific", "shared", "fallback"] },
          "theme_code": { "type": ["string", "null"] },
          "tone": { "type": ["string", "null"] },
          "intensity": { "type": ["string", "null"] },
          "main_signal_keys": {
            "type": "array",
            "maxItems": 5,
            "items": { "type": "string" }
          },
          "required_evidence_keys": {
            "type": "array",
            "maxItems": 4,
            "items": { "type": "string" }
          },
          "scores": { "type": "object" },
          "advice_axis": { "type": ["string", "null"] },
          "avoid_axis": { "type": ["string", "null"] },
          "watch_point": { "type": ["string", "null"] },
          "best_for": {
            "type": "array",
            "maxItems": 3,
            "items": { "type": "string" }
          },
          "fallback_reason": { "type": ["string", "null"] }
        }
      }
    },
    "best_slots": { "type": "array", "maxItems": 3 },
    "watch_slots": { "type": "array", "maxItems": 3 },
    "domain_sections": { "type": "array" },
    "main_signals": { "type": "array", "maxItems": 24 },
    "dominant_themes": { "type": "array", "maxItems": 4 },
    "evidence": { "type": "array", "maxItems": 60 }
  }
}
