{
  "contract_version": "horoscope_interpretation_request_v1",
  "service_code": "horoscope_free_daily",
  "period": {
    "date": "2026-06-06",
    "timezone": "Europe/Paris"
  },
  "target_language": "fr",
  "day_overview": {
    "dominant_theme": "daily_care",
    "tone": "mixed",
    "intensity": "high",
    "summary_hint": "Introduire la tonalite generale sans recopier ce texte dans chaque slot.",
    "evidence_keys": ["slot:day:moon:natal_house:6"]
  },
  "slots": [
    {
      "slot_code": "day",
      "slot_label": "Aujourd’hui",
      "specificity": "specific",
      "theme_code": "daily_care",
      "tone": "focused",
      "intensity": "high",
      "main_signal_keys": ["slot:day:moon:natal_house:6"],
      "required_evidence_keys": ["slot:day:moon:natal_house:6"],
      "advice_axis": "prioritize_concrete_action",
      "avoid_axis": "scattered_effort",
      "watch_point": "avoid_opening_too_many_topics",
      "best_for": ["organization", "routine"],
      "fallback_reason": null
    }
  ],
  "main_signals": [
    {
      "evidence_key": "slot:day:moon:natal_house:6",
      "fact_type": "moon_natal_house_activation",
      "slot_id": "day",
      "source": "fake_calculator_v1",
      "transiting_object": "moon",
      "natal_target": "natal_house_6",
      "aspect": null,
      "orb_deg": 0.8,
      "natal_house": 6,
      "theme_code": "daily_care",
      "priority_score": 1.97,
      "intensity": "high",
      "tone": "mixed",
      "duration_class": "daily_slot",
      "confidence_score": 0.86,
      "human_label": "Preuve astrologique retenue pour l'horoscope quotidien",
      "score_breakdown": {
        "aspect_weight": 1.0,
        "exactness_bonus": 0.15,
        "house_weight": 1.0,
        "natal_target_weight": 1.0,
        "orb_weight": 1.3,
        "theme_repetition_bonus": 0.0,
        "transiting_object_weight": 1.4,
        "weak_signal_penalty": 0.0
      }
    }
  ],
  "dominant_themes": [
    {
      "score": 1.97,
      "theme_code": "daily_care"
    }
  ],
  "evidence": [
    {
      "evidence_key": "slot:day:moon:natal_house:6",
      "fact_type": "moon_natal_house_activation",
      "slot_id": "day",
      "source": "fake_calculator_v1",
      "transiting_object": "moon",
      "natal_target": "natal_house_6",
      "aspect": null,
      "orb_deg": 0.8,
      "natal_house": 6,
      "theme_code": "daily_care",
      "priority_score": 1.97,
      "intensity": "high",
      "tone": "mixed",
      "duration_class": "daily_slot",
      "confidence_score": 0.86,
      "human_label": "Preuve astrologique retenue pour l'horoscope quotidien",
      "score_breakdown": {
        "aspect_weight": 1.0,
        "exactness_bonus": 0.15,
        "house_weight": 1.0,
        "natal_target_weight": 1.0,
        "orb_weight": 1.3,
        "theme_repetition_bonus": 0.0,
        "transiting_object_weight": 1.4,
        "weak_signal_penalty": 0.0
      }
    }
  ]
}
